category,likesNum,name,nameOnSite,descriptions
origins,0,Boardman,Boardman Themed Community,"Before Linden Homes, there was Boardman, an early experiment of a themed community in a gentle suburban style. Don't be surprised that the zoning guidelines date back to January 2003, and should you run across any of the locals, they're mighty friendly, so ask if they'll share their stories."
origins,0,Baffin,Baffin Island,"This island has seen many significant events, from its time as a welcoming spot for teen Residents ""graduating"" to adulthood to the hills used in Linden Lab ad promos for the then-new WindLight graphics. An abandoned library-turned-coffee shop is at the heart of it all, reminding us of how virtual connections can transform into real-life friendships."
origins,0,Stillman,Stillman Giant Bears,"These cuddly behemoths have welcomed travelers from all walks of Second Life to old Stillman, whether they were flying as avatars or arriving via zeppelin tours. Behind the bears, you can tour the legendary Ivory Tower of Primitives, where many generations of Residents have learned to build, and the freebie Bazaar and The Man statue are also worth sightseeing."
origins,0,Welsh,Climbable Beanstalk,"One of the oldest objects in SL is a beanstalk, created by Steller Sunshine in 2003. An influential model of organic shapes in a whimsical style, Steller used to hold contests challenging Residents to jump from leaf to leaf — can you make it to the top?"
origins,0,Natoma,The Man,"""The Man"" statue is one of the only surviving objects from the original ""Linden Town"" area that was developed in Second Life during the earliest Alpha stage of its development. At times, The Man has served as a shrine where miscellaneous offerings were left, and a celebration of the creativity SL was founded upon."
origins,0,Clementina,Governor Linden's Mansion,"Home to the mythical Governor who's as elusive as Bigfoot, this Second Life heritage home hasn't changed much since its inception in 2002. It remains one of the few preserved examples of what inworld architecture was like back in the day. Come visit and find out how early pioneers survived before sculpted prims, then stroll to the basement for a time capsule of vintage goods."
origins,0,Plum,Beta Contributor Wall,"Second Life continues to grow thanks to its Residents, and this monument recognizes the early ""beta pioneers"" who helped make the baby steps possible and pushed SL into the public eye (in hand — get it?). Head north to find a public sandbox that's still used to create content, and farther north to check out what an old Welcome Area used to look like."
origins,0,Phobos,SL Historical Museum,"Learn about the origins of Second Life and see displays of historical artifacts, images, and notecards that have been instrumental in shaping SL. Wear a free, fully-customizable avatar of our Primitar ""ancestors"" and relive magic from the early days."
science,0,MayLou,The Bell of Firmament,"This interactive exhibit visualizes star constellations in 3D by displaying their position, size, and color as seen from Earth. "
science,0,Science School II,Nuclear Power Plant Tour,Learn more about how nuclear power works by taking an interactive tour inside a 3D replica of a working nuclear power plant. This project was created by the Science School at the University of Denver.
science,0,Ellinogermaniki Agogi,Virtual Atlas,"Learn more about efforts to map the secrets of the universe at this interactive exhibit and virtual replica of the Atlas Experiment, a Large Hadron Collider at CERN. "
science,0,Sedig,Virtual Hallucinations,"This fascinating exhibit designed by medical researchers leads visitors through the minds of patients suffering with schizophrenia. While some may find the sim uncomfortable, there's no doubt the experience will leave Residents with a deeper understanding of this misunderstood disease. "
science,0,Science School,Science Friday,"NPR's weekly science news program, hosted by Ira Glass, is broadcast live on radio stations nationally between 11 a.m. and 1 p.m. Pacific time every Friday. Now, the show is also available to listen to live in Second Life."
science,0,The Tech,Tech Museum of Innovation,Explore the ever-changing interactive exhibits at The Tech Museum of Innovation.
science,0,Spaceport Alpha,Spaceflight Museum,The International Spaceflight Museum hosts a series of exhibits and events about real-world space travel.  
science,0,Genome,Genome Island,"Tiny cells and proteins make a big impression on this build dedicated to the study of microbiology. Step inside a rotating plasma membrane, check out elaborate dioramas, and play interactive games designed to teach students and scholars alike more about the micro world."
science,0,Exploratorium,Exploratorium Island,"Based on the Exploratorium Museum in San Francisco, this inworld exhibition area features several interactive attractions including The Tent of Elucidation, The Illusion Pavillion, PiHenge Circle and much more."
science,0,Honah Lee East,Palomar Observatory,The world famous Palomar Observatory sits majestically atop Honah Lee Mountain in the beautiful Blake Sea/Hollywood complex area of SL. Enter the observatory and learn about the building of the great observatory and enjoy great images of the night sky and lessons on astronomy. Great horseback riding (nine sims) surround the observatory.
sports,0,Mongoose,Mongoose MC,"The Mongoose MC sim is a great place to ride your motorcycle and hang out with other friendly riders and enthusiasts. With over five unique tracks to ride, live music, tribute bands, Mongoose is the place to be. "
sports,0,Oval Island,R.I.R Raceway,"R.I.R Raceway is a racing community built on making oval racing in Second Life as real as it can get. They've got advanced-style cars, pit stops, flat tires — you can even run out of gas! Come join in the fun or just watch some amazing racing action on weekly race days."
sports,0,Dark Sun Island,Emerald Crystal Golf Course,"Join golfers from around the globe at Emerald Crystal Golf Course. Play, laugh with friends new and old as you immerse yourself in this realistic digital environment. With traditional and unexpected hazards, greenery, wildlife and more, you really ought to see this virtual recreation of a time-honored sport. "
sports,0,Minx,Coalition Football League,"Coalition Football League is one of the newest, best football leagues in Second Life. It offers realistic gameplay on a scripted field of eighteen players. With over twelve teams, cheerleading squads and much more, all interested players should see the Coalition Football League!"
sports,0,Crossbones,Crossbones,"The Crossbones is one of the best places to ride your bike and meet other like-minded enthusiasts. Featuring two great motorcycle tracks, a biker club with music, good people and great bikes... You should come by and meet everyone. "
sports,0,hippie,Hippie's MC Riding,"Hippie's is a great place to ride motorcycles, listen to streaming music 24/7, play games and dance. Why not try your luck on the three timed tracks?"
international,0,Ibiza The Island,LFV Soccer Academy,"Welcome to Liga Futbol Virtual (LFV), the leading soccer community in Second Life. If you're interested in learning to play or you want to improve your technique, this is your opportunity! Are you the best soccer player on the grid? Since 2008, LFV is soccer. "
sports,0,Lavender,Aero Golf Club,"The Aero Golf Club is an 18-hole golf course designed to provide a beautiful landscape and experience. The course was created to be fun for the novice yet challenging for the seasoned player. A clubhouse also provides an intimate venue for socializing, dancing and meeting other golfers. Come on by and swing away!"
wilderness,0,Gecko,Gecko,"Relax to the sounds of parrots in the trees as you sit back in your rocking chair and chat with friends, Play checkers and gaze into the fire. "
sports,0,Thunder Rolls,Rocka-Fit Fitness Center,"Rocka-Fit Fitness Center is the premier gym for health and fitness in Second Life. There's access to fitness equipment, free weights, aerobic classes and much more. So tour our state-of-the-art facility and equipment, meet the toned personal trainers and sign up for a membership package today!"
wilderness,0,Capybara,Capybara ,Join the fun and meet your friends at this cool campsite in the Wilderness.
wilderness,0,Leech,Leech,"Visit this scenic social and fishing location to discover plenty of hidden spots and intriguing, mysterious avenues. Come explore! "
wilderness,0,Piranha,Piranha ,"Explore this social camp among mysterious ruins. Fish, dance, socialize and explore at this main gathering point in the Wilderness. "
wilderness,0,Salty Sands,King Izzy's Camping Adventure,"Experience the perfect vacation at King Izzy's Camping Adventure!  Spend a week camping in a campsite, relaxing in a fully-furnished cabin, or joining in the many fun activities. Join the monthly hunting contest, fish at Cherish's fishing hole, take a scenic trip down the river on a canoe or jetski, ride a 4-wheeler through the woods, go hiking or just laze around a campfire roasting marshmallows. Get away from it all at King Izzy's Camping Adventure!"
wilderness,0,Rosemist Isle,Rosemist Isle,"Rosemist Isle is dedicated to to the wonderment of life and the pursuit of peace and tranquility. It is also a quiet refuge of beauty that everyone may enjoy, perfect  for soothing the soul. Or just come and take scenic photographs and explore the myriad hidden areas."
sports,0,Racers Island,Racers Island,"Racers Island began by offering a multitude of racing styles. This racing community lets enthusiasts enjoy cruising or challenges with four races each week, stock, drift, carts, even destruction derby. They offer many tracks for personal vehicles, so join the community of 3500 members and get ready to race!"
sports,0,Shiva,Corse GP,Challenge others and enjoy the real-life racing atmosphere at Corse GP. This public circuit is open to anyone who enjoys the thrill of riding a speedy car or motorcycle. A free bike is provided for those who don't already own one.
sports,0,Allalinhorn,New Horizons Airport,"As one of the biggest airports in Second Life, New Horizons is large enough to receive even the biggest airliners. Adjacent to the airport, you'll find a fully-equipped hospital and a seaport."
sports,0,Balance,Vehicle Rezzing Area,"Got a new vehicle? This convenient rezzing zone is the place to give it a whirl. Rez  it, ride it or race it at this useful location."
sports,0,Georgean,Georgean Test Track,Rez your vehicles here and start racing on this test track built for fast-action fun.
sports,0,Golden Dawn,Turlaccor,"Turlaccor is a custom bike and motorcycle megastore. Whatever you need for your grid-based motorcycle needs, Turlaccor has it. "
sports,0,Devon Dream,Giant Snail Racing,"Witness or partake in a spectacular battle of massive mollusks on Sunday! Sunday! Sunday! It's Giant Snail Racing, a Second Life tradition since 2004, every Saturday at 11 a.m. (Pacific). If you missed a race, catch up with past episodes at treet.tv."
sports,0,BOOVILLE SKYDIVING,Booville Skydiving,"Experience extreme outdoor recreation, including skydiving, mountain biking and kart racing, at Booville Skydiving."
sports,0,Tuliptree,Virtual Railway Consortium,"Tuliptree is your starting point for the Virtual Railway Consortium. From here, train enthusiasts can explore the Heterocera Atoll Continent. There are numerous stations along the way where Residents can rez a train to start a journey. More info at http://www.virtualrailwayconsortium.org."
sports,0,Lionheart Ahadi,Rock'n Bowl Bowling Center,"Travel back to the 1980s and enjoy a night of bowling at Rock'n Bowl. Enjoy the greatest hits from the decade while you bowl the night away with family and friends. Rock'n Bowl is the perfect place to relax with friends, snacks and free shirts!"
sports,0,Gos,Quackerstone Duck Racing,"Hop on a rubber duckie and race your friends as you speed through a series of gates in this crazy racing course. If you time it right, you can hit a power up to quack past the competition."
sports,0,Caymen Shores,NRRA (Nina Roar Racing Association),The NRRA is a 500-member strong community brought together through an honest love and appreciation of the human spirit. This active racing community is the place to see elite drag cars and to connect with other fans of motorsports. Explore the more than 20 circuits of teams and individually owned race tracks.
sports,0,Bit Bat Bot,AZ Camping Central,"Grab a bunch of friends and pitch a tent, sit by a campfire and roast marshmallows. At AZ Camping Central, you will find a range of all your camping needs including kayaks, sleeping bags, tents, fishing kits, campfires and backpacks."
sports,0,St Diabloux,Prague Prefabrica Airport,"Explore the Prague Prefabrica Airport, a general aviation zone with access to the ocean and main Blake Sea air routes. There's parking for aircrafts, airplanes and pilot apparel available. Don't forget to try the flight school, free planes and the public marina."
sports,0,Champion Headquarters,Champion Horse Racing,Grab your derby hats and head on over to the Champion Horse Racing track. Watch the jockeys battle to the finish line during the many live races held weekly.
sports,0,EDO JAPAN,19 Motorcycle,"Check out both modern and vintage bikes and biker fashions at 19 Motorcycle, located in Edo Japan."
sports,0,Baitoushan,Baitoushan Intercontinental Airport,"Baitoushan Intercontinental Airport offers large dual runways (200m x 30m) and access to hundreds of mainland sims and four continents. Flying enthusiasts have access to a free public rez areas for aircraft and watercraft, as well as large hangars and a vending area.  "
strange,0,Galaxy Quest,The Crooked House,"Visit this recreation of Robert A. Heinlein's ""Crooked House"" by Seifert Surface. Explore the interconnected rooms of the house, which is modeled on a four-dimensional hypercube. Learn more about the story behind the house's creation at http://pdx.be/efe8."
sports,0,Bay City - Docklands,VRC's Bay City Train & Transit Station,"Trainspotters and public transit fans new and old meet at the VRC Substation for trips, freebies, and info.  Monitor real-time location of public transit vehicles serving Bay City and Nova Albion, including trolleys, ferries and balloons. Hop a free train and tour the SLRR short line through Bay City's industrial district."
strange,0,CSW Island,Stonehenge Rebuilt,This reconstruction of the Neolithic site of Stonehenge attempts to explain its lithology and show how it must have appeared in ancient times. It demonstrates how rays of sun passed between the megaliths during the summer solstice.
strange,0,Enchantment Island,Museum of Amazing Illusions,"Interactive and highly entertaining, The Museum of Amazing Illusions features a hall of mirrors and many extraordinary and baffling magic effects with information on how they tie in to real life and associated history. Experience the magic for yourself."
strange,0,Arkham,Arkham,This Massachusetts town is rooted in the late 19th and early 20th centuries. It's a mysterious place where the beautiful period architecture hides some darker secrets within.
strange,0,China,Chinese Bamboo Garden,"This sparse, minimalist build shows how a design can say a lot with very little. There might not be much under these charcoal gray skies but what there is leaves a profound impression. "
strange,0,Forgotten City,Forgotten City,"A once-great, clockpunk-ish city where the prosperous Residents were served by the miraculous mechanical automatons. The people have long since disappeared, but the automatons remained — and still take care of the crumbling stone walls, abandoned halls, and rusty fences."
strange,0,Hollow Woods,Hollow Woods,"Hollow Woods is a modern supernatural-horror experience that caters towards creative, paragraph-style roleplay. The game is based within the small island town of Hollow Woods, where unexplained events and a shady government-funded corporation are at the forefront of all those bumps in the night. Explore Hollow Woods and the rest of the island as it unfolds with real time events."
adult/roleplaying,0,Irreplaceable,Irreplaceable,"Irreplaceable is a small mysterious island on the north west corner of the grid. Come explore this explore this beautiful island with its castle, forest, rivers, grottoes and even an undersea cave. Irreplaceable is more than an island, it is a journey of discovery and exploration. "
strange,0,Bubblegum,Enchanted Alice,"Fall down the rabbit hole and explore a twisted adventure in a new take on Alice in Wonderland, or dance in the Enchanted Alice club. There's so much to experience here, from the crying lady in the water to the spinning teacup ride. You'll need plenty of time to see everything in this wonderful place."
strange,0,Magical Forest,Paradiso,"Paradiso is well endowed with photographic opportunities. This soothing location is perfect for exploring with lovers, wandering or just enjoying the scenery. Paradiso is surrounded by waves and strange lilies, who knows what other mysteries you'll find?"
surfing,0,Kauai,Kauai Surf Island,Aloha! Visit this surfing sim to catch the hottest waves and enjoy the Hawaiian spirit.
surfing,0,Pirate Point Break,Pirate Point Break,"Hit the waves, hang ten and meet new friends at this hot surf spot."
surfing,0,Chi,Chi,Chi is the home of the first Second Life Surfing Association competition and still the longest standing surfing sim in SL.
surfing,0,Tai,T'ai Surfing,"Visit the beautiful sister of the Zen resort Ch'i. Surf on the new SSI ""Cortes"" wave, on a dual-synced pipe or fluffies. The surf sims T'ai and Ch'i are the original home base for people that appreciate love, beauty and surfing."
surfing,0,Bouraq,Liquid Shaman,"Enjoy the waves at Liquid Shaman, a fun beach sim that includes surfing, para-sailing, scuba diving, fishing and much more. Don't overlook the secret spots hidden underneath the water. "
strange,0,Aletheia,Aletheia,"Walking around Aletheia is like crawling around the skeleton of a mutant beetle. Slimy and creepy, this nightmarish build is guaranteed to give someone the willies, especially those who don't like bugs."
strange,0,Land of Glory,La Città Perdu,"There's plenty to explore at ""The Lost Town."" Italian-style shops in an industrial port environment await visitors, but there are also some hidden secrets, like an abandoned subway. In addition, a romantic cave makes an interesting contrast to the rest of the region."
strange,0,Iris,Temple of Iris,Explore the secrets of SL at the mystical Moth Temple of Iris.
strange,0,Pheosia,Weirdiculous,"Just because it's silly, doesn't mean it can't be stylish. If you're in the mood for something strange, Weirdiculous offers a wide range of crazy costumes, gifts, and other items which are guaranteed to raise a smile."
strange,0,Off The Wall,Off The Wall,"Beneath the giant toys is a sensory overload of fun quests to complete for prizes, constructed by equally colorful characters. Don't miss the many crazy references to geek culture, video games, Internet memes, and more."
strange,0,Tableau,Tableau,"Explore the wonders of this desert town, including bombed-out buildings, colorful stucco construction and tumbling tumbleweeds, all situated in a tantalizing desert light. Shop, explore and enjoy the luscious scenery! "
strange,0,Seokcheon,Olivia's Creepy Diner,Check out the spooky vibes here at this rockabilly-themed greasy spoon. Watch out for the the tumblin' tumbleweeds!
strange,0,Pyri Peaks,Pyri Funfair,"Something sinister seems to be lurking in and around the Pyri Funfair, where you can brave the Tunnel of Love, explore a cave maze or uncover other hidden surprises."
surfing,0,Eden Cygnet,Eden Cygnet,"Come enjoy the beach and waves in a great naturist setting in Eden. They have occasional beach dance parties, an airport, marina, surf boards and more. Come join the gang and make some great new friends in a very relaxed and respectful naturist surfing environment. Look forward to seeing you there."
surfing,0,Solace Dreams,SL Surfing Association,"Welcome to the SL Surfing Archipelago, home of the SL Surfing Association and the SL Surfing Hall of Fame. Awesome waves are always running. There are free loaner boards for you to use, and a rez area to use your own. Plenty of beach for chillaxin'! Check out the video reel of radical SL Surfing videos. You'll also find freebies and much more! Join the tubular action."
surfing,0,Evil Spirits,Momo's Surf Club,"Momo's Surf Club is a great place to hang out and learn the ropes with a newbie-friendly atmosphere. They welcome everyone: local, national and international. They offer games, rides, shopping, and overall fun! Momo's has the friendliest people that are always willing to help or just hangout and have a good time. You'll be glad you came to Momo's."
surfing,0,San Javier,Cielopolis,"Let your dream come true at Cielopolis. Come surf, relax, chat or ride personal watercraft to 42 sail-able sims. They also have luxurious yacht rental and full land rights. Everything's handmade and built for your pleasure, it only needs you to make it real."
surfing,0,Eden Bay,Global Surf Treaty,Island Sea Dreams & Ellimatta Banyandah are a surfing community.Global Surf Treaty runs surf lessons and events for anyone wanting to surf in Second Life. Find your smooth transition over the waves.
zombies,0,Mustang Bay,Grimly's Bloodbath & Beyond,"Grimly's Bloodbath & Beyond is a unique combat sim where you can help save the world from the zombie apocalypse. Use an original combat system to fight zombies or do fun quests. There are also addition levels to tackle, including a desert area filled with mummies and a medieval fantasy world with orcs, goblins and elves."
zombies,0,Cayuga,Zombie Attack,"When the zombies attack, will you be ready... or will you be DEAD? "
zombies,0,Miho,Miho's Zombie Attack,"From the instant you arrive at Miho's Retreat, you'll be surrounded by zombies on the attack. Are you ready to take them on?"
underwater,0,Pravatch,Pravatch,"Explore life at the bottom of the ocean at this simple yet enchanting tropical reef. Schools of colorful fish swim by you and the bright and sparkly coral formations make for great picture spots. "
underwater,0,Rua,Cave Rua Water Gardens,"Coral and seaweed mingle with these ruins, providing a haunting yet beautiful atmosphere to swim through. Look for the shipwrecks but don't get stung by the jellyfish. Other reefs and attractions are also in the area."
underwater,0,Enchantment Island,Deep Sea Marine Life,Swim with manta rays or any of the hundred other deep sea marine life forms in this aquatic showcase. Here you'll find everything from familiar tropical fish to rare deep sea amoeba-like creatures that are available from the Great Aquatic Marine Tropical Fish & Aquarium Superstore.
strange,0,Porto,Delicatessen Petrified,"Floating islands, like a Roger Dean album cover, idle over the sparse landscape — each containing a diorama of haunting and unsettling sculptures. Your fight-or-flight reflex will kick in as your brain struggles to make sense of these bizarre scenes."
underwater,0,Beach walk cafe,Secret Cave Under Beach Walk Cafe,"There's fun in the sun, but there's also fun in finding special spots like this underwater cave, which has numerous poseballs to relax on. When you're done, head up to the surface and stretch out under the palm trees."
underwater,0,Enchantment Island,The Great Marine Adventure & Treasure Hunt,Explore tunnels and caves as you search for treasure chests with many surprises along the way. Can you solve the riddle to find the missing pirate’s loot?
underwater,0,Wyrldmaker,Suboceana Scuba Diving,"Suboceana offers innovative applications that help people explore the evolving story of the Earth's oceans, including issues surrounding pollution and cleanup. Discover an amazing underwater photo exhibit. Grab your free Heavy Footer scuba gear and explore a submarine wreck and much more."
underwater,0,Two Moon Paradise,Two Moon Paradise's Mer Garden,"An underworld fantasy land with mer dance animations, sea horse tours and beautiful mer gardens. Explore and participate in the many live music events held here. More at http://twomoonparadise.wordpress.com."
underwater,0,Lily,The Jules Verne Museum,"Visitors can take an extraordinary underwater voyage here. With a full-size submarine to explore, this museum offers insight into the life and work of French science fiction writer Jules Verne."
underwater,0,Union Passage,The Blake Deeps,"Welcome to the undersea world of Blake Deeps. Never before has such a large expanse of marine environment been created to cater to the fantasy adventures of merfolk, sealife, divers, explorers and ocean lovers of all types. Located in the center of  Blake Sea, it spreads over thirteen private sims and is home and playground for all subsea enthusiasts. Don't miss the adventure!"
winter,0,Cross Check,Chamonix City,"Learn about the winter sports community in Second Life at Chamonix City. You'll find new friends and tons of activities in this eight-sim winter sports community filled with ice hockey, ice skating, snowboarding and more!"
winter,0,FRANCE3D Chamonix,Chamonix Winter Sports Center,"Enjoy snowboarding, sledging, skiing and ice-skating at FRANCE3D's winter sports area. There are also some great sightseeing opportunities and an underground disco club to party at once the sun goes down."
winter,0,Sparrow Song,Sparrow Song,"Sparrow Song is an intricately designed, snow-dusted fantasy realm. Wander through this glowing realm of ice sculptures, mysterious forests, delicate castles and ancient mysteries. Something magnificent waits around every corner at Sparrow Song."
